,date_time,tweet_id,author_id,tweet_text,account,cleaned_text,hashtags
179,2018-09-26T21:34:00.000Z,1045063965875851264,14216661,#ICYMI: Volunteers in Ottawa step in to help hundreds of elderly residents without food after storm https://t.co/fUj7TlORqd,nationalpost,ICYMI: Volunteers in Ottawa step in to help hundreds of elderly residents without food after storm,['ICYMI']
180,2018-09-26T03:59:08.000Z,1044798499991310336,14216661,Elderly man rescued after spending five days trapped in fire-damaged senior complex https://t.co/6b75dayci5 https://t.co/NRKbl5UkDz,nationalpost,Elderly man rescued after spending five days trapped in fire-damaged senior complex,[]
181,2018-09-07T20:44:02.000Z,1038166022472327168,14216661,.@drivingdotca’s David Booth: “Waymo’s self-driving cars follow the rules so strictly it’s infuriating”: https://t.co/cHoaNhKR5T https://t.co/xiq4nzaY9t,nationalpost,. David Booth: Waymos self-driving cars follow the rules so strictly its infuriating:,[]
182,2018-09-04T14:53:14.000Z,1036990575004676096,14216661,"You’re not deathly ill, just getting on in age. Is suicide by older adults ever a rational choice? https://t.co/vq8fCL7Z4C https://t.co/rCFcByFRPN",nationalpost,"Youre not deathly ill, just getting on in age. Is suicide by older adults ever a rational choice?",[]
183,2018-08-13T21:40:11.000Z,1029120457881149440,14216661,Trudeau says Liberals have no plans to bring back long-gun registry after Fredericton shooting https://t.co/f7j5ioY4sv https://t.co/DaVOtpkl2a,nationalpost,Trudeau says Liberals have no plans to bring back long-gun registry after Fredericton shooting,[]
184,2018-08-08T04:10:03.000Z,1027044240747102208,14216661,#ICYMI - Two elderly men went missing. They were found rocking out at the world's biggest heavy metal festival https://t.co/nQxJjM7Wdq https://t.co/YaSkS8r1tf,nationalpost,ICYMI - Two elderly men went missing. They were found rocking out at the world's biggest heavy metal festival,['ICYMI']
185,2018-08-07T17:43:39.000Z,1026886603745230848,14216661,Two elderly men went missing. They were found rocking out at the world's biggest heavy metal festival https://t.co/hsjZwNpM9I https://t.co/RA8n1xQiPk,nationalpost,Two elderly men went missing. They were found rocking out at the world's biggest heavy metal festival,[]
186,2018-08-03T15:24:44.000Z,1025402094055038977,14216661,German court throws out appeal for elderly neo-Nazi who repeatedly said Auschwitz was just a work camp https://t.co/2MrZerKcPU https://t.co/dFneHVjVI7,nationalpost,German court throws out appeal for elderly neo-Nazi who repeatedly said Auschwitz was just a work camp,[]
187,2018-07-24T21:37:43.000Z,1021872078700654595,14216661,"In emergencies, the elderly die. Here's how we can start to change that https://t.co/69Ogk53nv5 https://t.co/rQq1h7GwN3",nationalpost,"In emergencies, the elderly die. Here's how we can start to change that",[]
188,2018-07-09T22:41:54.000Z,1016452413564309508,14216661,Grey Matters: Honouring your life with a memorial service https://t.co/KTLk3oXIKc https://t.co/IeusLwjOw0,nationalpost,Grey Matters: Honouring your life with a memorial service,[]
189,2018-07-04T18:49:18.000Z,1014581937086849024,14216661,"John Ivison: Who's more vulnerable than our venerable seniors? In fact, just about everyone https://t.co/UNKtLa7f0k https://t.co/AJ7OVwbahk",nationalpost,"John Ivison: Who's more vulnerable than our venerable seniors? In fact, just about everyone",[]
190,2018-07-03T22:41:21.000Z,1014277945865711616,14216661,Grey Matters: When it comes to medication - less is more https://t.co/muegfb17wL https://t.co/bX6EH6WTqp,nationalpost,Grey Matters: When it comes to medication - less is more,[]
191,2018-06-19T01:16:26.000Z,1008881157839220736,14216661,Grey Matters: Shielding ourselves from the realities of death https://t.co/QTLvga2yHq https://t.co/dOCqJFNHge,nationalpost,Grey Matters: Shielding ourselves from the realities of death,[]
192,2018-06-14T17:16:24.000Z,1007310801408012288,14216661,"Stan Lee files restraining order against shady business manager, as LA police continue investigation into elder abuse https://t.co/OTAk7ntNqD via @nparts https://t.co/EhSuP8e0Ct",nationalpost,"Stan Lee files restraining order against shady business manager, as LA police continue investigation into elder abuse via",[]
193,2018-06-12T02:54:51.000Z,1006369208236683264,14216661,Grey Matters: Strategic retirement planning more challenging as we age https://t.co/aOmZuFE6QP https://t.co/EUAIUcqQbf,nationalpost,Grey Matters: Strategic retirement planning more challenging as we age,[]
194,2018-06-05T06:20:59.000Z,1003884370934026240,14216661,Grey Matters: Caregivers deserve better https://t.co/pyGWQTm6je https://t.co/iPq5H4FwBH,nationalpost,Grey Matters: Caregivers deserve better,[]
195,2018-06-04T18:29:21.000Z,1003705279958192129,14216661,Inside the CPP Investment Board: Why CPPIB is working with China to help it tackle it's aging population problem https://t.co/WKqj8yrKCR https://t.co/lZ4yP4rUii,nationalpost,Inside the CPP Investment Board: Why CPPIB is working with China to help it tackle it's aging population problem,[]
196,2018-05-23T23:40:59.000Z,999435052076470273,14216661,What today's savers can learn from today's seniors about retirement planning https://t.co/OdxEbtFIZa https://t.co/3S65NaEWGo,nationalpost,What today's savers can learn from today's seniors about retirement planning,[]
197,2018-05-14T21:37:23.000Z,996142454322683907,14216661,"Owning $4 million house in Vancouver no blessing as seniors face $2,000 a year more in taxes https://t.co/Kx2DH1lwi4 https://t.co/BAgj8uzi7A",nationalpost,"Owning $4 million house in Vancouver no blessing as seniors face $2,000 a year more in taxes",[]
198,2018-05-14T16:13:55.000Z,996061052428341248,14216661,A looming housing affordability crisis is poised to hit seniors across Canada https://t.co/fDEihh5J2n https://t.co/xTsWj1UHGU,nationalpost,A looming housing affordability crisis is poised to hit seniors across Canada,[]
199,2018-05-14T11:43:43.000Z,995993056561246208,14216661,"Housing crisis to hit Canadian seniors, as retirement homes fail to keep up with demand https://t.co/kTpioOlRnx https://t.co/66dYag2Sjb",nationalpost,"Housing crisis to hit Canadian seniors, as retirement homes fail to keep up with demand",[]
200,2018-05-14T04:21:55.000Z,995881873854402560,14216661,"#ICYMI - Housing crisis to hit Canadian seniors, as retirement homes fail to keep up with demand https://t.co/3dRi68gGwI https://t.co/gesP8rscFI",nationalpost,"ICYMI - Housing crisis to hit Canadian seniors, as retirement homes fail to keep up with demand",['ICYMI']
201,2018-05-13T22:08:08.000Z,995787806969561088,14216661,"Housing crisis to hit Canadian seniors, as retirement homes fail to keep up with demand https://t.co/blwMeYw17u https://t.co/6Mjb6PppnI",nationalpost,"Housing crisis to hit Canadian seniors, as retirement homes fail to keep up with demand",[]
202,2018-05-02T21:45:05.000Z,991795739876581377,14216661,He was one of millions of Chinese seniors growing old alone. So he put himself up for adoption https://t.co/UtelNpCexn https://t.co/29Rd6NrSf0,nationalpost,He was one of millions of Chinese seniors growing old alone. So he put himself up for adoption,[]
203,2018-04-26T17:14:52.000Z,989553407752114178,14216661,An 83-year-old convicted killer who walked away from a B.C. prison is back in custody https://t.co/coKAVHKAYw https://t.co/kxaFIujaQf,nationalpost,An 83-year-old convicted killer who walked away from a B.C. prison is back in custody,[]
204,2018-04-17T02:53:09.000Z,986075062087356419,14216661,"Grey Matters: Alternative therapy can be deadly, says study https://t.co/s8aCaFL0ol https://t.co/LBylw36qXc",nationalpost,"Grey Matters: Alternative therapy can be deadly, says study",[]
205,2018-04-11T20:58:23.000Z,984173841328033792,14216661,'An utter s--t show': Stan Lee's daughter and other associates are accused of grotesque elder abuse against the Marvel legend https://t.co/JWVOAYd0zH https://t.co/G8a0w0Bd8p,nationalpost,'An utter s--t show': Stan Lee's daughter and other associates are accused of grotesque elder abuse against the Marvel legend,[]
206,2018-04-10T01:12:44.000Z,983513073813262336,14216661,Grey Matters: Be wary of buying into some homeopathic claims https://t.co/e06N26t66x https://t.co/aVCTdj5pNN,nationalpost,Grey Matters: Be wary of buying into some homeopathic claims,[]
207,2018-03-27T21:48:48.000Z,978750711616954368,14216661,Grey Matters: Strategies to help you win with financial institutions https://t.co/mV18kreNvM https://t.co/C1jZZLJA5w,nationalpost,Grey Matters: Strategies to help you win with financial institutions,[]
208,2018-01-26T14:17:32.000Z,956893875985149952,14216661,"A church elder's Ashley Madison affairs led him to the 'dark web' — and murder, police say https://t.co/tAEDFBjMJp https://t.co/4ZOTmCCvzk",nationalpost,"A church elder's Ashley Madison affairs led him to the 'dark web' and murder, police say",[]
209,2018-01-22T13:09:04.000Z,955427093474697222,14216661,Do economic expansions die of old age? Or does something (NAFTA failure) kill them? The upcoming week in economics https://t.co/PDYrJLxZn4 https://t.co/ZpFTKP4KAs,nationalpost,Do economic expansions die of old age? Or does something (NAFTA failure) kill them? The upcoming week in economics,[]
210,2018-01-05T14:21:30.000Z,949284727890022400,14216661,"Elderly Ontario couple dies in the cold; After Grant had a heart attack outside, Ada went to find him https://t.co/IlnbICI1Fl https://t.co/haKGbMD0Cq",nationalpost,"Elderly Ontario couple dies in the cold; After Grant had a heart attack outside, Ada went to find him",[]
