,date_time,tweet_id,author_id,tweet_text,account,cleaned_text,hashtags
0,2022-02-11T19:43:47.000Z,1492222856482197506,14216661,Number of seniors seeking help with debt is rising dramatically — here are some common causes https://t.co/6qxEwVwlO1,nationalpost,Number of seniors seeking help with debt is rising dramatically here are some common causes,[]
1,2022-02-01T13:22:24.000Z,1488502997671989250,14216661,Financial abuse of seniors a growing problem amid pandemic isolation https://t.co/OrbRWMQdQ3,nationalpost,Financial abuse of seniors a growing problem amid pandemic isolation,[]
2,2022-01-31T21:49:02.000Z,1488268108355837954,14216661,"When care partners of older adults first encounter symptoms of dementia, many assume the symptoms are a normal part of aging. This lack of knowledge needs to be addressed to facilitate the first step in seeking dementia care - via @healthing_ca https://t.co/jQb8WmoG9M",nationalpost,"When care partners of older adults first encounter symptoms of dementia, many assume the symptoms are a normal part of aging. This lack of knowledge needs to be addressed to facilitate the first step in seeking dementia care - via",[]
3,2022-01-24T22:31:33.000Z,1485742094798966791,14216661,"COVID-19 has amplified existing cracks in the long-term care system in Canada. We need socially innovative solutions to help seniors age safely and with dignity - via @healthing_ca

#healthing  https://t.co/TA558iDxjm",nationalpost,COVID-19 has amplified existing cracks in the long-term care system in Canada. We need socially innovative solutions to help seniors age safely and with dignity - via healthing,['healthing']
4,2022-01-24T19:03:48.000Z,1485689813378510849,14216661,"According to new research from New York University, older adults who are socially isolated are more likely to lose teeth - via @healthing_ca

#healthing   https://t.co/yUR3g46qdP",nationalpost,"According to new research from New York University, older adults who are socially isolated are more likely to lose teeth - via healthing",['healthing']
5,2022-01-24T17:03:45.000Z,1485659601693556736,14216661,"According to new research from New York University, older adults who are socially isolated are more likely to lose teeth - via @healthing_ca

#healthing  https://t.co/APeZL0obx4",nationalpost,"According to new research from New York University, older adults who are socially isolated are more likely to lose teeth - via healthing",['healthing']
6,2022-01-24T11:31:08.000Z,1485575893112299527,14216661,"HIIT improves memory in younger and older adults in ways that standard, moderate exercise can’t - via @healthing_ca

#healthing  https://t.co/UtdjIn3zZw",nationalpost,"HIIT improves memory in younger and older adults in ways that standard, moderate exercise cant - via healthing",['healthing']
7,2022-01-21T13:02:18.000Z,1484511673717252096,14216661,"Experts say one of the most pressing ways to prepare for this shifting demographic is to support seniors aging at home - via @healthing_ca

#healthing  https://t.co/75JjBC3xln",nationalpost,Experts say one of the most pressing ways to prepare for this shifting demographic is to support seniors aging at home - via healthing,['healthing']
8,2022-01-13T13:05:53.000Z,1481613470822981637,14216661,Is the '4% rule' still the magic key to making money last in old age? https://t.co/EDP6LvO1dA,nationalpost,Is the '4% rule' still the magic key to making money last in old age?,[]
9,2022-01-11T16:22:54.000Z,1480938277695799302,14216661,Cambodia's top mine-sniffing rat dies of natural causes after saving hundreds of lives https://t.co/1KG7eCNaWA https://t.co/OBNM4RtShD,nationalpost,Cambodia's top mine-sniffing rat dies of natural causes after saving hundreds of lives,[]
10,2022-01-08T00:16:39.000Z,1479607947999252484,14216661,"Across the province, orderlies in the same program are dropping out of the profession by the hundreds, according to statistics provided by the provincial health ministry - via @healthing_ca

#healthing  https://t.co/vyFkjw7tgX",nationalpost,"Across the province, orderlies in the same program are dropping out of the profession by the hundreds, according to statistics provided by the provincial health ministry - via healthing",['healthing']
11,2021-12-27T17:41:39.000Z,1475522277529866248,14216661,"A new study has found that 5 or more servings of walnuts per week may lower the risk of death from cardiovascular disease by 25% among older adults and increase life expectancy by over a year - via @healthing_ca

#healthing  https://t.co/cV6X6t4EOD",nationalpost,A new study has found that 5 or more servings of walnuts per week may lower the risk of death from cardiovascular disease by 25% among older adults and increase life expectancy by over a year - via healthing,['healthing']
12,2021-12-16T13:45:06.000Z,1471476480848900105,14216661,"These tax changes in the latest fiscal update affect employees, seniors, students and more https://t.co/CW001wHDtc",nationalpost,"These tax changes in the latest fiscal update affect employees, seniors, students and more",[]
13,2021-12-13T12:59:06.000Z,1470377742008999938,14216661,Michael Taube: Bob Dole — an elder statesman who will be fondly remembered https://t.co/KNopkmDAnk,nationalpost,Michael Taube: Bob Dole an elder statesman who will be fondly remembered,[]
14,2021-11-29T18:10:19.000Z,1465382629881040901,14216661,Pandemic depression persists among older adults: Study https://t.co/0cJQLbmVMY — via @healthing_ca,nationalpost,Pandemic depression persists among older adults: Study via,[]
15,2021-11-27T11:56:16.000Z,1464563724879028224,14216661,"André Pratte: The 3,901 seniors who died in Quebec's long-term care disaster deserve accountability https://t.co/mIQmHGVeYJ",nationalpost,"Andr Pratte: The 3,901 seniors who died in Quebec's long-term care disaster deserve accountability",[]
16,2021-11-16T16:07:54.000Z,1460640783829196807,14216661,Influx of aging baby boomers puts Canadian elder care homes on pace for record investment https://t.co/1HEtBjJ6xO,nationalpost,Influx of aging baby boomers puts Canadian elder care homes on pace for record investment,[]
17,2021-11-15T15:16:18.000Z,1460265409580613638,14216661,"Thousands of low-income families, seniors see decline in federal aid benefits, documents show https://t.co/Fog62xF9Hh",nationalpost,"Thousands of low-income families, seniors see decline in federal aid benefits, documents show",[]
18,2021-11-13T23:38:00.000Z,1459666890041741314,14216661,"Thousands of low-income families, seniors see decline in federal aid benefits, documents show https://t.co/UVFfpxn8kG",nationalpost,"Thousands of low-income families, seniors see decline in federal aid benefits, documents show",[]
19,2021-11-04T14:05:45.000Z,1456261386242170894,14216661,"While the pandemic was hard on many parts of the workforce, seniors took it on the chin https://t.co/t6qXa926Km",nationalpost,"While the pandemic was hard on many parts of the workforce, seniors took it on the chin",[]
20,2021-10-27T15:33:01.000Z,1453384246689685515,14216661,"Here are the new faces in cabinet https://t.co/mqOpsdMlFa

@KamalKheraLib – Minister of Seniors

#CDNpoli https://t.co/QGDELgfZOq",nationalpost,Here are the new faces in cabinet Minister of Seniors CDNpoli,['CDNpoli']
21,2021-10-13T12:58:11.000Z,1448271848857288707,14216661,"Earthquakes, elder care and innovation on shortlist for new literary prize https://t.co/iDGXinu7rU",nationalpost,"Earthquakes, elder care and innovation on shortlist for new literary prize",[]
22,2021-09-03T16:58:51.000Z,1433836902801678355,14216661,Belly fat and weak muscles risky for seniors: study https://t.co/LhOLpD8SG2 — via @healthing_ca,nationalpost,Belly fat and weak muscles risky for seniors: study via,[]
23,2021-09-02T00:01:52.000Z,1433218581282578432,14216661,"Pink Cars with Toyota Badges: Helping seniors get vaxxed https://t.co/a6iGKswLYN — via @drivingdotca

#autonews",nationalpost,Pink Cars with Toyota Badges: Helping seniors get vaxxed via autonews,['autonews']
24,2021-08-22T10:44:39.000Z,1429394075535486979,14216661,"Raymond J. de Souza: America is a country governed by the elderly, and it's starting to show https://t.co/S1QEARCBQ0",nationalpost,"Raymond J. de Souza: America is a country governed by the elderly, and it's starting to show",[]
25,2021-08-19T21:48:59.000Z,1428474099693727749,14216661,"The study also found greater effectiveness in those receiving Moderna doses in comparison to those who received the Pfizer vaccine. https://t.co/Fofutt2fx7

— via @healthing_ca",nationalpost,The study also found greater effectiveness in those receiving Moderna doses in comparison to those who received the Pfizer vaccine. via,[]
26,2021-08-05T13:50:15.000Z,1423280190298357760,14216661,Seniors in 'complete shock' when income supplement cut after receiving emergency benefits https://t.co/VBNKaVdOIu https://t.co/2ardfMUNOw,nationalpost,Seniors in 'complete shock' when income supplement cut after receiving emergency benefits,[]
27,2021-07-27T13:10:34.000Z,1420008715118391298,14216661,"New rules boost financial protection for seniors, but getting them to opt in can be a delicate process https://t.co/vptEX4jaT9",nationalpost,"New rules boost financial protection for seniors, but getting them to opt in can be a delicate process",[]
28,2021-07-20T17:43:12.000Z,1417540607862509570,14216661,"Any type of tea can help counter obesity, stress and heart disease in young children, and reduce risk of stroke among the elderly, study says.
- via @healthing_ca https://t.co/ZUzkGksoSk",nationalpost,"Any type of tea can help counter obesity, stress and heart disease in young children, and reduce risk of stroke among the elderly, study says. - via",[]
29,2021-07-14T13:04:53.000Z,1415296242729488387,14216661,Older seniors to get extra Old Age Security in the coming months https://t.co/wp3WWG5aZG,nationalpost,Older seniors to get extra Old Age Security in the coming months,[]
30,2021-07-07T18:05:44.000Z,1412835237575499781,14216661,"Social isolation can affect the cognitive and psychological health of seniors. https://t.co/hUv9setpNH

— via @healthing_ca",nationalpost,Social isolation can affect the cognitive and psychological health of seniors. via,[]
31,2021-07-06T22:53:02.000Z,1412545152330121224,14216661,New Governor General proved the elder Trudeau wrong https://t.co/zmGOwVHKeB,nationalpost,New Governor General proved the elder Trudeau wrong,[]
32,2021-07-01T22:22:00.000Z,1410725401404461059,14216661,"Hundreds who died from heat exposure in B.C. were mostly seniors found alone in unventilated suites, says coroner https://t.co/6JJh8hzjpB",nationalpost,"Hundreds who died from heat exposure in B.C. were mostly seniors found alone in unventilated suites, says coroner",[]
33,2021-06-02T19:06:11.000Z,1400166876102148100,14216661,Updated: Nazi-looted painting in bizarre custody battle pitting U.S. college against elderly French heiress https://t.co/GKj2NSu9MX,nationalpost,Updated: Nazi-looted painting in bizarre custody battle pitting U.S. college against elderly French heiress,[]
34,2021-05-24T13:03:37.000Z,1396814141613084673,14216661,#ICYMI - Austrian hospital amputates wrong leg of elderly patient in 'tragic mistake' https://t.co/K60v7RH1TR,nationalpost,ICYMI - Austrian hospital amputates wrong leg of elderly patient in 'tragic mistake',['ICYMI']
35,2021-05-11T18:14:54.000Z,1392181438146035712,14216661,"Vaping is up across the board, but the biggest hikes were in female students. https://t.co/VvQxDi9h9o

— via @TheGrowthOp",nationalpost,"Vaping is up across the board, but the biggest hikes were in female students. via",[]
36,2021-05-11T04:15:24.000Z,1391970169472393221,14216661,Munk Debate: Can we stop people from dying of old age? https://t.co/5gBWRGIIXs,nationalpost,Munk Debate: Can we stop people from dying of old age?,[]
37,2021-05-06T13:28:19.000Z,1390297373960667136,14216661,Opinion: The budget's Old Age Security increase is bad policy https://t.co/iPHyUMU0V8,nationalpost,Opinion: The budget's Old Age Security increase is bad policy,[]
38,2021-05-02T14:00:27.000Z,1388855910668328960,14216661,"Some older adults are using cannabis to self-treat without first seeking medical advice. https://t.co/FgimHmUzVA

— via @TheGrowthOp",nationalpost,Some older adults are using cannabis to self-treat without first seeking medical advice. via,[]
39,2021-03-29T13:47:55.000Z,1376531569968619526,14216661,"A growing number of more seniors may be using medical cannabis. https://t.co/X7rUC5HNAo

— via @TheGrowthOp",nationalpost,A growing number of more seniors may be using medical cannabis. via,[]
40,2021-03-28T19:59:55.000Z,1376262800348168192,14216661,Some young people to get COVID vaccine months early thanks to program for apartment-dwelling seniors https://t.co/yUswpdfKTh,nationalpost,Some young people to get COVID vaccine months early thanks to program for apartment-dwelling seniors,[]
41,2021-03-27T12:34:40.000Z,1375788360778797058,14216661,Some young people to get COVID vaccine months early thanks to program for apartment-dwelling seniors https://t.co/JNpDZ3myRL,nationalpost,Some young people to get COVID vaccine months early thanks to program for apartment-dwelling seniors,[]
42,2021-03-25T17:42:24.000Z,1375141028727029762,14216661,Elderly Asian woman who fought back against attacker donates $1 million raised to charity https://t.co/VYBPKk9WIr,nationalpost,Elderly Asian woman who fought back against attacker donates $1 million raised to charity,[]
43,2021-03-24T00:04:48.000Z,1374512485772845061,14216661,"COVID-19 in seniors doesn't always have the telltale respiratory signs. https://t.co/5B4rpzGTCO

— via @healthing_ca",nationalpost,COVID-19 in seniors doesn't always have the telltale respiratory signs. via,[]
44,2021-03-17T14:00:24.000Z,1372186056670515205,14216661,"Several European countries also reversed the recommendation against using the vaccine on seniors. https://t.co/i7XElxpPih

— via @healthing_ca",nationalpost,Several European countries also reversed the recommendation against using the vaccine on seniors. via,[]
45,2021-03-17T01:49:52.000Z,1372002211140677637,14216661,"AstraZeneca vaccine now recommended for use on seniors, Canadian committee says https://t.co/xM6uWDtw1z",nationalpost,"AstraZeneca vaccine now recommended for use on seniors, Canadian committee says",[]
46,2021-03-03T20:00:53.000Z,1367203344910061571,14216661,"While vaccinating the elderly is still a priority, other groups are moving up in line.  https://t.co/ROXLtOqx5H

— via @healthing_ca",nationalpost,"While vaccinating the elderly is still a priority, other groups are moving up in line. via",[]
47,2021-03-02T04:21:29.000Z,1366604548639490050,14216661,"Canada shouldn't use AstraZeneca COVID vaccine on seniors, national panel advises https://t.co/bPSJjio0XB",nationalpost,"Canada shouldn't use AstraZeneca COVID vaccine on seniors, national panel advises",[]
48,2021-03-02T00:30:44.000Z,1366546480396464134,14216661,Montreal opens Olympic Stadium to elderly for COVID vaccinations as Canada plays catch-up https://t.co/abr9S4FlhN,nationalpost,Montreal opens Olympic Stadium to elderly for COVID vaccinations as Canada plays catch-up,[]
49,2021-02-26T18:13:25.000Z,1365364359598395394,14216661,"Bad Driver of the Week: Sorry, no senior's discount on stunt driving charges https://t.co/xGDJhwAfXd — via @drivingdotca

#autonews",nationalpost,"Bad Driver of the Week: Sorry, no senior's discount on stunt driving charges via autonews",['autonews']
50,2021-02-24T22:01:50.000Z,1364697067180982273,14216661,"Alberta seniors rush to book COVID-19 vaccines, while Ontario develops plan to immunize elderly https://t.co/DCyqNnOhsw",nationalpost,"Alberta seniors rush to book COVID-19 vaccines, while Ontario develops plan to immunize elderly",[]
51,2021-02-11T15:30:12.000Z,1359887467206356995,14216661,Pain relief offered by cannabis may have contributed to the reduction in blood pressure. https://t.co/cEjs135SBx — via @TheGrowthOp,nationalpost,Pain relief offered by cannabis may have contributed to the reduction in blood pressure. via,[]
52,2021-01-31T20:00:29.000Z,1355969219012263937,14216661,"#ICYMI: Should seniors take driver's license renewal tests under lockdown? https://t.co/RciaVTam4d — via @drivingdotca

#lockdown #driving #pandemic",nationalpost,ICYMI: Should seniors take driver's license renewal tests under lockdown? via lockdown driving pandemic,"['ICYMI', 'lockdown', 'driving', 'pandemic']"
53,2021-01-26T17:01:20.000Z,1354112195660021762,14216661,"Should seniors take driver's license renewal tests under lockdown? https://t.co/zPy7jMQbbx — via @drivingdotca

#lockdown #driving #pandemic",nationalpost,Should seniors take driver's license renewal tests under lockdown? via lockdown driving pandemic,"['lockdown', 'driving', 'pandemic']"
54,2021-01-25T23:35:23.000Z,1353848972901834753,14216661,"Due to shortage, Ontario pauses vaccination of essential workers to focus on seniors https://t.co/5A10gZ6z89",nationalpost,"Due to shortage, Ontario pauses vaccination of essential workers to focus on seniors",[]
55,2021-01-12T20:56:53.000Z,1349098044831182848,14216661,Watch: Nomadic Inuit elder explains what it's like to live off the land https://t.co/7D3twi7ddx Video by @ArcticFocus https://t.co/Vzn4uyTFuJ,nationalpost,Watch: Nomadic Inuit elder explains what it's like to live off the land Video by,[]
56,2020-12-30T22:16:12.000Z,1344406961526333440,14216661,Prince Charles has been talking to Canada’s Aboriginal elders about threats to the planet https://t.co/VWR0WIO0ap — via @Telegraph,nationalpost,Prince Charles has been talking to Canadas Aboriginal elders about threats to the planet via,[]
57,2020-12-17T04:36:03.000Z,1339429124578959360,14216661,Video: Nomadic Inuit elder on what it's like to live off the land https://t.co/hxJDGF7eux,nationalpost,Video: Nomadic Inuit elder on what it's like to live off the land,[]
58,2020-12-11T15:06:57.000Z,1337413569378398211,14216661,One of the vaccines ordered by Canada fails to protect older adults from COVID-19 https://t.co/DFnFa9SBFq,nationalpost,One of the vaccines ordered by Canada fails to protect older adults from COVID-19,[]
59,2020-11-17T22:35:28.000Z,1328829134508855296,14216661,Older adults increasingly chose to manage their mental health by themselves. https://t.co/M8GamDCO8E — via @healthing_ca,nationalpost,Older adults increasingly chose to manage their mental health by themselves. via,[]
60,2020-10-21T14:45:37.000Z,1318926419456675840,14216661,Old-age is the next global economic threat https://t.co/Sb6wfkD09p,nationalpost,Old-age is the next global economic threat,[]
61,2020-10-20T15:25:00.000Z,1318573941498253312,14216661,"The retirement downsizing myth: No, seniors aren't moving in droves — and that will affect the housing market https://t.co/6LE82vavKl",nationalpost,"The retirement downsizing myth: No, seniors aren't moving in droves and that will affect the housing market",[]
62,2020-10-16T11:57:31.000Z,1317072176047161349,14216661,Vivian Bercovici: COVID is no excuse to impose cruel and inhumane measures on the elderly https://t.co/scCjSC5Y3v,nationalpost,Vivian Bercovici: COVID is no excuse to impose cruel and inhumane measures on the elderly,[]
63,2020-10-15T18:05:26.000Z,1316802379199676418,14216661,"Ontario will end teacher hiring rules based on seniority, says education minister https://t.co/Brj8Mcwsqq",nationalpost,"Ontario will end teacher hiring rules based on seniority, says education minister",[]
64,2020-10-15T17:32:11.000Z,1316794011307380736,14216661,"Ontario will end teacher hiring rules based on seniority, says education minister https://t.co/00yqTEsEd5",nationalpost,"Ontario will end teacher hiring rules based on seniority, says education minister",[]
65,2020-10-01T15:09:43.000Z,1311684727028543489,14216661,Bank holding B.C. senior's lottery winnings 'hostage' despite proof he is of sound mind https://t.co/KP7h6o85gx,nationalpost,Bank holding B.C. senior's lottery winnings 'hostage' despite proof he is of sound mind,[]
66,2020-09-06T13:00:33.000Z,1302592526088536064,14216661,"“The Baby Boom is a generation of aging weekend warriors, and we’re all looking for relief so that we can stay in the game.” Via: @TheGrowthOp 

https://t.co/7TbZ0m6JlB",nationalpost,"The Baby Boom is a generation of aging weekend warriors, and were all looking for relief so that we can stay in the game. Via:",[]
67,2020-08-13T01:27:34.000Z,1293720821358362626,14216661,Unreported deaths in COVID-19 outbreak at seniors residence adds to Quebec's pandemic toll https://t.co/B1J7wMYuCr,nationalpost,Unreported deaths in COVID-19 outbreak at seniors residence adds to Quebec's pandemic toll,[]
68,2020-07-27T21:15:07.000Z,1287859082708254721,14216661,"Researchers have found that for-profit elderly care facilities have lower quality of care in both the U.S. and Canada. Via: @healthing_ca 

https://t.co/tnxkzmGiz6",nationalpost,Researchers have found that for-profit elderly care facilities have lower quality of care in both the U.S. and Canada. Via:,[]
69,2020-06-30T21:11:39.000Z,1278073737837977601,14216661,"The COVID-19 pandemic has made it clear that Canada needs to change the way we care for our older adults. — via @healthing_ca
https://t.co/UX6LAtfP95",nationalpost,The COVID-19 pandemic has made it clear that Canada needs to change the way we care for our older adults. via,[]
70,2020-06-17T09:13:41.000Z,1273182013068017664,14216661,#ICYMI - Senior Living: This boomer has put her travelling days behind her https://t.co/R2VwuRb3rA,nationalpost,ICYMI - Senior Living: This boomer has put her travelling days behind her,['ICYMI']
71,2020-06-16T08:06:50.000Z,1272802805334659072,14216661,Senior Living: This boomer has put her travelling days behind her https://t.co/rGCx2boOYT,nationalpost,Senior Living: This boomer has put her travelling days behind her,[]
72,2020-06-16T06:23:08.000Z,1272776707481747456,14216661,Senior Living: Do you dare to leverage? Maybe. But don’t buy stocks. https://t.co/bL4okfjeXF,nationalpost,Senior Living: Do you dare to leverage? Maybe. But dont buy stocks.,[]
73,2020-06-12T18:31:06.000Z,1271510353432776705,14216661,"Elderly protester shoved by Buffalo police suffered 'brain injury,' lawyer says https://t.co/zALyIHsV1Y",nationalpost,"Elderly protester shoved by Buffalo police suffered 'brain injury,' lawyer says",[]
74,2020-06-10T19:17:16.000Z,1270797195508355072,14216661,Vivian Bercovici: We have failed the elderly during the COVID-19 crisis https://t.co/ZDsBOAwR1f,nationalpost,Vivian Bercovici: We have failed the elderly during the COVID-19 crisis,[]
75,2020-06-09T06:47:44.000Z,1270246182065967105,14216661,Senior Living: The real cost of social distancing https://t.co/3zkrMXJv0v,nationalpost,Senior Living: The real cost of social distancing,[]
76,2020-06-09T06:22:33.000Z,1270239846200721409,14216661,Senior Living: Time to lock in a low borrowing rate https://t.co/Ns5O0akFjL,nationalpost,Senior Living: Time to lock in a low borrowing rate,[]
77,2020-06-08T13:01:19.000Z,1269977808106856449,14216661,"Beyond our basic hierarchy of needs, recreation can also help allay other issues of elderly care. — via @healthing_ca 
https://t.co/xF8TJt5r9L",nationalpost,"Beyond our basic hierarchy of needs, recreation can also help allay other issues of elderly care. via",[]
78,2020-06-06T15:25:05.000Z,1269289215801667584,14216661,"#ICYMI: Seniors are getting a special payout from Ottawa, but not this month
https://t.co/vxUhjMlIaW",nationalpost,"ICYMI: Seniors are getting a special payout from Ottawa, but not this month",['ICYMI']
79,2020-06-01T06:50:26.000Z,1267347759096647680,14216661,Senior Living: Your TFSA is an essential tool https://t.co/zgsidKAiSN,nationalpost,Senior Living: Your TFSA is an essential tool,[]
80,2020-06-01T06:36:29.000Z,1267344249353375744,14216661,Senior Living: Gardening does a body good https://t.co/8jaWs1VWc4,nationalpost,Senior Living: Gardening does a body good,[]
81,2020-05-29T00:10:08.000Z,1266159857721360384,14216661,"Don Braid: Kenney normalizing COVID-19 as a risk mainly to the elderly, almost zero danger to the young https://t.co/qewR3y9fRZ",nationalpost,"Don Braid: Kenney normalizing COVID-19 as a risk mainly to the elderly, almost zero danger to the young",[]
82,2020-05-26T09:37:42.000Z,1265215523639357442,14216661,#ICYMI - Senior Living: Travelling across the seas at 90 years https://t.co/DPTdRFWM97,nationalpost,ICYMI - Senior Living: Travelling across the seas at 90 years,['ICYMI']
83,2020-05-25T21:43:09.000Z,1265035701239844865,14216661,Here's all the financial relief the government is offering seniors and what might be on tap https://t.co/xiIuzrToYp,nationalpost,Here's all the financial relief the government is offering seniors and what might be on tap,[]
84,2020-05-25T13:17:55.000Z,1264908558728134657,14216661,Here's all the financial relief the government is offering seniors and what might be on tap https://t.co/IgTzk0wT4J,nationalpost,Here's all the financial relief the government is offering seniors and what might be on tap,[]
85,2020-05-25T09:19:57.000Z,1264848668768821253,14216661,"Senior Living: Having a will makes good sense, but many still need one https://t.co/XKW8Jo6O7d",nationalpost,"Senior Living: Having a will makes good sense, but many still need one",[]
86,2020-05-25T06:30:53.000Z,1264806124701827072,14216661,Senior Living: Travelling across the seas at 90 years https://t.co/CqXVk2YKne,nationalpost,Senior Living: Travelling across the seas at 90 years,[]
87,2020-05-22T17:21:33.000Z,1263882705546158080,14216661,Here's all the financial relief the government is offering seniors and what might be on tap https://t.co/DP8hq5BBGH,nationalpost,Here's all the financial relief the government is offering seniors and what might be on tap,[]
