,date_time,tweet_id,author_id,tweet_text,account,cleaned_text,hashtags
88,2020-05-22T13:45:32.000Z,1263828343910252544,14216661,Downsizing in decimated Alberta housing market the key to securing this senior's retirement https://t.co/W8JzrfVs9Z #familyfinance,nationalpost,Downsizing in decimated Alberta housing market the key to securing this senior's retirement familyfinance,['familyfinance']
89,2020-05-22T12:20:28.000Z,1263806937084448768,14216661,Twenty-eight Canadian soldiers test positive for COVID-19 after helping in seniors homes https://t.co/e9rKVpJRk2,nationalpost,Twenty-eight Canadian soldiers test positive for COVID-19 after helping in seniors homes,[]
90,2020-05-19T10:16:58.000Z,1262688693992796163,14216661,"#ICYMI - Senior Living: For many Canadians, being alone is just fine https://t.co/9JE21YGw3o",nationalpost,"ICYMI - Senior Living: For many Canadians, being alone is just fine",['ICYMI']
91,2020-05-18T06:54:33.000Z,1262275364648374272,14216661,Senior Living: Some good financial news on the horizon https://t.co/usuMMhjY2E,nationalpost,Senior Living: Some good financial news on the horizon,[]
92,2020-05-18T05:36:53.000Z,1262255817622982657,14216661,"Senior Living: For many Canadians, being alone is just fine https://t.co/f3WrHB2ObV",nationalpost,"Senior Living: For many Canadians, being alone is just fine",[]
93,2020-05-17T15:43:01.000Z,1262045967815249920,14216661,#ICYMI - Four out of five COVID-19 deaths have been linked to seniors homes. That says a lot about how Canada regards its elders https://t.co/DaPtqVt5jB,nationalpost,ICYMI - Four out of five COVID-19 deaths have been linked to seniors homes. That says a lot about how Canada regards its elders,['ICYMI']
94,2020-05-16T14:04:42.000Z,1261658839163850752,14216661,Four out of five COVID-19 deaths have been linked to seniors homes. That says a lot about how Canada regards its elders https://t.co/VToO8Hw5NN,nationalpost,Four out of five COVID-19 deaths have been linked to seniors homes. That says a lot about how Canada regards its elders,[]
95,2020-05-12T23:20:00.000Z,1260349031844323330,14216661,"$2.5B COVID-19 aid package for seniors gives too much to people who don't need it, experts say https://t.co/zU3fpMCQ7x",nationalpost,"$2.5B COVID-19 aid package for seniors gives too much to people who don't need it, experts say",[]
96,2020-05-12T18:10:09.000Z,1260271059548413952,14216661,"Senior Living: A day in the life of a Facebook addict
https://t.co/M7vvEOesgD",nationalpost,Senior Living: A day in the life of a Facebook addict,[]
97,2020-05-12T15:05:11.000Z,1260224511246503937,14216661,Feds to give seniors one-time payment of $300 to $500 to help with coronavirus costs https://t.co/GxRTky5pDM,nationalpost,Feds to give seniors one-time payment of $300 to $500 to help with coronavirus costs,[]
98,2020-05-11T16:49:53.000Z,1259888471180787712,14216661,Senior Living: A day in the life of a Facebook addict https://t.co/tFTTsAhIq7,nationalpost,Senior Living: A day in the life of a Facebook addict,[]
99,2020-05-11T16:29:30.000Z,1259883340242595842,14216661,"Senior Living: This financial crisis, too, shall pass https://t.co/eYCPzPWOQh",nationalpost,"Senior Living: This financial crisis, too, shall pass",[]
100,2020-05-11T03:42:11.000Z,1259690236830986242,14216661,Vancouver's long-term care homes pinpoint COVID-19 cases by testing seniors for broad range of symptos https://t.co/3yTy23PEkv,nationalpost,Vancouver's long-term care homes pinpoint COVID-19 cases by testing seniors for broad range of symptos,[]
101,2020-05-05T04:21:39.000Z,1257525843825512448,14216661,Consider a collateral charge https://t.co/1TU5K7UXSy,nationalpost,Consider a collateral charge,[]
102,2020-05-04T07:17:45.000Z,1257207771260497922,14216661,Senior Living: Sunshine is only part of a healthy approach https://t.co/3G5TGfi1ol,nationalpost,Senior Living: Sunshine is only part of a healthy approach,[]
103,2020-05-03T22:41:07.000Z,1257077758666125314,14216661,COVID-19 pandemic forces high school seniors to grapple with possibility of no graduation ceremonies https://t.co/XohKuNBFhG,nationalpost,COVID-19 pandemic forces high school seniors to grapple with possibility of no graduation ceremonies,[]
104,2020-04-27T21:45:25.000Z,1254889412305043458,14216661,Senior Living: A retirement wake-up call https://t.co/l3uJStsC1n,nationalpost,Senior Living: A retirement wake-up call,[]
105,2020-04-27T17:16:06.000Z,1254821636487905282,14216661,Senior Living: Good deeds benefit both the receiver and the doer https://t.co/6MogYovQph,nationalpost,Senior Living: Good deeds benefit both the receiver and the doer,[]
106,2020-04-21T18:17:16.000Z,1252662703165968389,14216661,"#ICYMI - Senior Living: Don’t panic, don’t sell on the stock market https://t.co/18SJ1f9DWZ",nationalpost,"ICYMI - Senior Living: Dont panic, dont sell on the stock market",['ICYMI']
107,2020-04-20T07:09:31.000Z,1252132271114551297,14216661,"Senior Living: Don’t panic, don’t sell on the stock market https://t.co/BJjJsuBioG",nationalpost,"Senior Living: Dont panic, dont sell on the stock market",[]
108,2020-04-20T06:28:10.000Z,1252121864249454593,14216661,Senior Living: Caution and calm will defeat chaos in a crisis https://t.co/Xtxj8divdw,nationalpost,Senior Living: Caution and calm will defeat chaos in a crisis,[]
109,2020-04-17T17:55:19.000Z,1251207627398434816,14216661,NP View: The COVID-19 crisis has exposed Canada's shameful treatment of the elderly https://t.co/9Ft3NADcgA https://t.co/HUPQTPDYnp,nationalpost,NP View: The COVID-19 crisis has exposed Canada's shameful treatment of the elderly,[]
110,2020-04-13T08:22:09.000Z,1249613834769371136,14216661,Senior Living: Just give the stock market time https://t.co/oklqEbPw4U,nationalpost,Senior Living: Just give the stock market time,[]
111,2020-04-13T06:52:50.000Z,1249591358794469380,14216661,Seniors Living: Grooming during self-isolation a hairy situation https://t.co/Dp3xmu2LRz,nationalpost,Seniors Living: Grooming during self-isolation a hairy situation,[]
112,2020-04-12T04:29:17.000Z,1249192844276969483,14216661,Here's what the new RRIF withdrawal rules mean for seniors' savings and taxes https://t.co/iVnrNObdIP,nationalpost,Here's what the new RRIF withdrawal rules mean for seniors' savings and taxes,[]
113,2020-04-11T15:10:27.000Z,1248991810460045313,14216661,Here's what the new RRIF withdrawal rules mean for seniors' savings and taxes https://t.co/KlHwITjwTV,nationalpost,Here's what the new RRIF withdrawal rules mean for seniors' savings and taxes,[]
114,2020-04-10T20:16:48.000Z,1248706517060194304,14216661,"Public health finds bodies, feces at Dorval seniors’ residence: sources https://t.co/HP9HicvvUB",nationalpost,"Public health finds bodies, feces at Dorval seniors residence: sources",[]
115,2020-04-10T19:42:57.000Z,1248697998315569153,14216661,Here's what the new RRIF withdrawal rules mean for seniors' savings and taxes https://t.co/ICzNDWtqRI,nationalpost,Here's what the new RRIF withdrawal rules mean for seniors' savings and taxes,[]
116,2020-04-10T13:42:31.000Z,1248607292183826438,14216661,Here's what the new RRIF withdrawal rules mean for seniors' savings and taxes https://t.co/hdM7m6Iu5n,nationalpost,Here's what the new RRIF withdrawal rules mean for seniors' savings and taxes,[]
117,2020-04-07T08:23:32.000Z,1247439853530370050,14216661,"#ICYMI - Seniors Living: You can’t control luck, but you can work hard https://t.co/mNG7qQHcDY",nationalpost,"ICYMI - Seniors Living: You cant control luck, but you can work hard",['ICYMI']
118,2020-04-06T07:50:42.000Z,1247069204718784517,14216661,"Seniors Living: You can’t control luck, but you can work hard https://t.co/4JAsKjWuac",nationalpost,"Seniors Living: You cant control luck, but you can work hard",[]
119,2020-04-06T06:20:30.000Z,1247046506894503938,14216661,Senior Living: Go cashless at your own pace https://t.co/i0DSomEweu,nationalpost,Senior Living: Go cashless at your own pace,[]
120,2020-04-01T19:01:59.000Z,1245426200018857984,14216661,"COVID-19: From one lockdown to another, residents at Canada's seniors homes face new reality https://t.co/xSzoeTUXUX",nationalpost,"COVID-19: From one lockdown to another, residents at Canada's seniors homes face new reality",[]
121,2020-03-31T22:00:21.000Z,1245108698919440388,14216661,"Self-isolation can make it challenging for seniors to eat healthily. — via @healthing_ca 

https://t.co/eRPs6ldz4m",nationalpost,Self-isolation can make it challenging for seniors to eat healthily. via,[]
122,2020-03-30T23:25:51.000Z,1244767829594984451,14216661,Emergency COVID-19 measures enacted for Canada's seniors' homes where pandemic hits hardest https://t.co/89ain0lgZL,nationalpost,Emergency COVID-19 measures enacted for Canada's seniors' homes where pandemic hits hardest,[]
123,2020-03-30T23:06:01.000Z,1244762838322810887,14216661,Senior Living: What government benefits should you be aware of? https://t.co/HlvSZj3T7Q,nationalpost,Senior Living: What government benefits should you be aware of?,[]
124,2020-03-30T21:26:12.000Z,1244737715243016193,14216661,"Senior Living: After a fall, everything changed https://t.co/jUOgATECwl",nationalpost,"Senior Living: After a fall, everything changed",[]
125,2020-03-24T03:58:48.000Z,1242299804056793095,14216661,Senior Living: The art of idleness https://t.co/uGqAA5S6ZY,nationalpost,Senior Living: The art of idleness,[]
126,2020-03-24T02:05:09.000Z,1242271203550728192,14216661,Senior Living: Future tax strategies https://t.co/AsfnpavB4Q,nationalpost,Senior Living: Future tax strategies,[]
127,2020-03-23T20:09:26.000Z,1242181683731980295,14216661,"With #SocialDistancing measures in place, it's more important than ever for seniors to stay fit — here are some tips from @healthing_ca 

#COVID19 
https://t.co/z4yNwEBtTE",nationalpost,"With SocialDistancing measures in place, it's more important than ever for seniors to stay fit here are some tips from COVID19","['SocialDistancing', 'COVID19']"
128,2020-03-16T13:27:59.000Z,1239543941483171842,14216661,"COVID-19 Italy: Elderly may be left to die in new protocol aimed at containing virus crisis
https://t.co/LlyfqolRFx
#COVIDー19 #COVID19 #Coronavirus",nationalpost,COVID-19 Italy: Elderly may be left to die in new protocol aimed at containing virus crisis COVID19 COVID19 Coronavirus,"['COVID19', 'COVID19', 'Coronavirus']"
129,2020-03-16T08:31:03.000Z,1239469215939166210,14216661,Senior Living: Separate bank accounts or joint? https://t.co/oGrh37Dj1q,nationalpost,Senior Living: Separate bank accounts or joint?,[]
130,2020-03-16T06:42:16.000Z,1239441839511547904,14216661,Senior Living: Cancer survivor Mike Boone grateful for support https://t.co/k1m0Ik1E3k,nationalpost,Senior Living: Cancer survivor Mike Boone grateful for support,[]
131,2020-03-14T20:00:21.000Z,1238917907356225536,14216661,"Older adults and those with pre-existing health conditions seem to be the most at risk compared to children — via @healthing_ca 

https://t.co/xG9dIC2Y4c",nationalpost,Older adults and those with pre-existing health conditions seem to be the most at risk compared to children via,[]
132,2020-03-13T19:40:05.000Z,1238550419921678336,14216661,'Disastrous': Seniors face double threat from pandemic as retirement portfolios walloped by markets in turmoil https://t.co/bPBaiSNYz5,nationalpost,'Disastrous': Seniors face double threat from pandemic as retirement portfolios walloped by markets in turmoil,[]
133,2020-03-13T13:55:55.000Z,1238463805153214471,14216661,'Disastrous': Seniors face double threat from pandemic as retirement portfolios walloped by markets in turmoil https://t.co/KridxuFbl4,nationalpost,'Disastrous': Seniors face double threat from pandemic as retirement portfolios walloped by markets in turmoil,[]
134,2020-03-11T13:18:03.000Z,1237729499095105537,14216661,"The overall death rate from the virus in Italy is now estimated at the surprisingly high 6 per cent, with more than 10,000 confirmed infections, amid fears that the health system has been overwhelmed by predominantly elderly patients.
https://t.co/Yy6Arxnbfv
#COVID19 https://t.co/DP78YVHVmB",nationalpost,"The overall death rate from the virus in Italy is now estimated at the surprisingly high 6 per cent, with more than 10,000 confirmed infections, amid fears that the health system has been overwhelmed by predominantly elderly patients. COVID19",['COVID19']
135,2020-03-06T00:07:34.000Z,1235718631100755975,14216661,Senior Living: Think about drawing benefits when you near retirement https://t.co/wO3HgCqLQW,nationalpost,Senior Living: Think about drawing benefits when you near retirement,[]
136,2020-03-05T19:30:50.000Z,1235648986054193153,14216661,"Senior Living: Even in our 90s, we carry on https://t.co/NDBDp73XNF",nationalpost,"Senior Living: Even in our 90s, we carry on",[]
137,2020-02-28T18:30:10.000Z,1233459392093315077,14216661,"These unfair tax policies are putting a burden on women and seniors and need to be changed now
https://t.co/W6vulTgkII",nationalpost,These unfair tax policies are putting a burden on women and seniors and need to be changed now,[]
138,2020-02-27T19:02:57.000Z,1233105255035998208,14216661,Rude awakening for employee who thought seniority would save him from sexual banter complaint https://t.co/SsmJBZocXd,nationalpost,Rude awakening for employee who thought seniority would save him from sexual banter complaint,[]
139,2020-02-27T17:00:33.000Z,1233074452663013379,14216661,"From @healthing_ca: Medical experts have controversially refused to endorse cognitive screening for older adults, calling for more research.  

https://t.co/3xubwN4odW",nationalpost,"From : Medical experts have controversially refused to endorse cognitive screening for older adults, calling for more research.",[]
140,2020-02-20T19:00:55.000Z,1230568026547740672,14216661,OSC proposes mutual fund restrictions to protect seniors from large penalties https://t.co/5CVg5X1oVC,nationalpost,OSC proposes mutual fund restrictions to protect seniors from large penalties,[]
141,2020-01-30T15:25:19.000Z,1222903626290479111,14216661,What would you do with 20 extra years? Scientists are close to extending a human's 'healthy lifespan' https://t.co/7re7VB071H https://t.co/iKZzqrhtHk,nationalpost,What would you do with 20 extra years? Scientists are close to extending a human's 'healthy lifespan',[]
142,2020-01-23T14:41:48.000Z,1220355958326595586,14216661,These unfair tax policies are putting a burden on women and seniors and need to be changed now https://t.co/0FngK0gc1v https://t.co/Hyb1saXjli,nationalpost,These unfair tax policies are putting a burden on women and seniors and need to be changed now,[]
143,2020-01-14T15:53:24.000Z,1217112487692242944,14216661,Reverse mortgage business is booming in Canada as seniors tap home equity to pay debts https://t.co/AdGOZFfWYG https://t.co/iSsHdvzZps,nationalpost,Reverse mortgage business is booming in Canada as seniors tap home equity to pay debts,[]
144,2020-01-14T12:01:17.000Z,1217054073209397248,14216661,Reverse mortgage business is booming in Canada as seniors tap home equity to pay debts https://t.co/uvzE2qr2K9 https://t.co/JmhgTomChn,nationalpost,Reverse mortgage business is booming in Canada as seniors tap home equity to pay debts,[]
145,2019-12-30T23:42:11.000Z,1211794642578104326,14216661,"#ICYMI - Dozens evacuated after fire in seniors' residence in Trois-Pistoles, Que. https://t.co/KBCSHdHsxQ https://t.co/ehl0sqicj8",nationalpost,"ICYMI - Dozens evacuated after fire in seniors' residence in Trois-Pistoles, Que.",['ICYMI']
146,2019-12-29T23:28:02.000Z,1211428694650212354,14216661,"Dozens evacuated after fire in seniors' residence in Trois-Pistoles, Que. https://t.co/W3h2tPhach https://t.co/8EvRnfPR7o",nationalpost,"Dozens evacuated after fire in seniors' residence in Trois-Pistoles, Que.",[]
147,2019-11-13T22:46:39.000Z,1194748439432744960,14216661,Inactive older adults can lower heart disease risk by ramping up exercise: study https://t.co/YDMVnVgGSm https://t.co/FacMfSnb0v,nationalpost,Inactive older adults can lower heart disease risk by ramping up exercise: study,[]
148,2019-11-03T22:02:14.000Z,1191113382621040641,14216661,Seniors embracing cannabis faster than any other demographic in Canada https://t.co/ecCKiSjUjO via @TheGrowthOp https://t.co/s2dLf4gvMA,nationalpost,Seniors embracing cannabis faster than any other demographic in Canada via,[]
149,2019-09-30T23:20:12.000Z,1178811813212938240,14216661,Protesters scream 'Nazi scum' as they bar way of elderly woman https://t.co/Y5cKhhaENM https://t.co/DBwkcGP1Os,nationalpost,Protesters scream 'Nazi scum' as they bar way of elderly woman,[]
150,2019-09-23T15:36:00.000Z,1176158278864244736,14216661,Sponsored: Canada’s rapidly aging population is contributing to an emerging vision crisis. @EssilorCanada,nationalpost,Sponsored: Canadas rapidly aging population is contributing to an emerging vision crisis.,[]
151,2019-09-16T22:56:45.000Z,1173732482123993089,14216661,Don't-pay-til-you-die reverse mortgages are booming in Canada as seniors binge on debt https://t.co/fpoRAyU3tW https://t.co/F21wT0k0SX,nationalpost,Don't-pay-til-you-die reverse mortgages are booming in Canada as seniors binge on debt,[]
152,2019-09-16T13:22:08.000Z,1173587875918766080,14216661,Don't-pay-til-you-die reverse mortgages are booming in Canada as seniors binge on debt https://t.co/oYnvDucZU0 https://t.co/ukaHWhjQIv,nationalpost,Don't-pay-til-you-die reverse mortgages are booming in Canada as seniors binge on debt,[]
153,2019-08-31T02:29:30.000Z,1167625429026529280,14216661,There are more seniors than ever and where they choose to live could reshape Canada's housing market https://t.co/Rgt5GVZCsm https://t.co/viWNtLZrgV,nationalpost,There are more seniors than ever and where they choose to live could reshape Canada's housing market,[]
154,2019-07-25T20:32:36.000Z,1154489648816803840,14216661,Sponsored: Active seniors retire amidst the power of the Rocky Mountains at Origin at Spring Creek in Canmore. #OriginSpringCreek,nationalpost,Sponsored: Active seniors retire amidst the power of the Rocky Mountains at Origin at Spring Creek in Canmore. OriginSpringCreek,['OriginSpringCreek']
155,2019-07-25T16:30:29.000Z,1154428717420228609,14216661,"Sponsored: Seniors savour Rocky Mountain retirement at Origin at Spring Creek in Canmore, Alberta. #OriginSpringCreek",nationalpost,"Sponsored: Seniors savour Rocky Mountain retirement at Origin at Spring Creek in Canmore, Alberta. OriginSpringCreek",['OriginSpringCreek']
156,2019-07-25T16:30:06.000Z,1154428623543255040,14216661,Sponsored: Active seniors retire amidst the power of the Rocky Mountains at Origin at Spring Creek in cosmopolitan Canmore. #OriginSpringCreek,nationalpost,Sponsored: Active seniors retire amidst the power of the Rocky Mountains at Origin at Spring Creek in cosmopolitan Canmore. OriginSpringCreek,['OriginSpringCreek']
157,2019-07-24T19:28:43.000Z,1154111185878487040,14216661,There are more seniors than ever and where they choose to live could reshape Canada's housing market https://t.co/SGoVLcw4ed https://t.co/GT92bqdKdJ,nationalpost,There are more seniors than ever and where they choose to live could reshape Canada's housing market,[]
158,2019-06-26T11:52:17.000Z,1143849461371854848,14216661,"'Old age is an excellent time for outrage,' comedian Mary Walsh tells ideacity audience https://t.co/t6vE9JCmwR https://t.co/GwvJvlu6Ef",nationalpost,"'Old age is an excellent time for outrage,' comedian Mary Walsh tells ideacity audience",[]
159,2019-06-19T22:55:18.000Z,1141479598351425536,14216661,Prince William and Kate's police motorbike escort seriously injures elderly woman https://t.co/k0EPcbP8yS https://t.co/c9SbPcpGjm,nationalpost,Prince William and Kate's police motorbike escort seriously injures elderly woman,[]
160,2019-06-12T23:14:43.000Z,1138947770461671425,14216661,A rise in traffic accidents caused by drivers over 75 has Japan considering a new licensing system for the elderly—should Canada look at doing the same? The proposed restrictions over at @drivingdotca: https://t.co/joGTk5kW7w https://t.co/j5YpFXxsoP,nationalpost,A rise in traffic accidents caused by drivers over 75 has Japan considering a new licensing system for the elderlyshould Canada look at doing the same? The proposed restrictions over at :,[]
161,2019-05-15T18:05:21.000Z,1128723054203371520,14216661,"Vernon, B.C., rejects pot shop proposal as 'it is too close to seniors' https://t.co/WnO7dTut6T via @TheGrowthOp https://t.co/OZGl13PGh4",nationalpost,"Vernon, B.C., rejects pot shop proposal as 'it is too close to seniors' via",[]
162,2019-05-14T19:05:55.000Z,1128375907184455680,14216661,"Vernon, B.C., rejects pot shop proposal as 'it is too close to seniors' https://t.co/iearMN8mbn via @TheGrowthOp https://t.co/9ypxEznvWw",nationalpost,"Vernon, B.C., rejects pot shop proposal as 'it is too close to seniors' via",[]
163,2019-04-25T21:21:31.000Z,1121524662637297679,14216661,Enter the elder statesman https://t.co/eKGDQlNArh,nationalpost,Enter the elder statesman,[]
164,2019-03-19T20:28:18.000Z,1108102922347442177,14216661,"* $1.8 billion for retirees, including support for low-income seniors, “empowering seniors in their communities” and a promise to make sure that “everyone who is eligible receives Canada Pension Plan benefits,” which is not listed as having a cost.",nationalpost,"* $1.8 billion for retirees, including support for low-income seniors, empowering seniors in their communities and a promise to make sure that everyone who is eligible receives Canada Pension Plan benefits, which is not listed as having a cost.",[]
165,2019-03-12T00:08:38.000Z,1105259265856557057,14216661,First Nations elder says sacred medicine pouch was ‘desecrated’ when airport security forced her to open it https://t.co/SfWC54rGhu https://t.co/l8gemOP8p7,nationalpost,First Nations elder says sacred medicine pouch was desecrated when airport security forced her to open it,[]
166,2019-03-08T00:51:19.000Z,1103820457340489729,14216661,Here’s why seniors are turning to marijuana. https://t.co/xJVjYX7usC https://t.co/n7guYpaJ5G,nationalpost,Heres why seniors are turning to marijuana.,[]
167,2019-02-13T15:01:47.000Z,1095699562080145413,14216661,A caller tried to scam a 90-year-old man. The elderly ex-FBI and CIA director orchestrated a reverse sting https://t.co/WezjowfwfC https://t.co/OJFOw5Pti6,nationalpost,A caller tried to scam a 90-year-old man. The elderly ex-FBI and CIA director orchestrated a reverse sting,[]
168,2019-01-21T17:08:33.000Z,1087396543844544512,14216661,Silver pot: Marijuana use is growing among seniors. Is that good or bad? https://t.co/CylgRm0sCE https://t.co/8tztkMHbly,nationalpost,Silver pot: Marijuana use is growing among seniors. Is that good or bad?,[]
169,2019-01-21T14:55:49.000Z,1087363140134809601,14216661,The teen in the MAGA hat and the elderly Native American: Duelling accounts at DC protest https://t.co/HusqnKTzHY https://t.co/x7E6VvEd3m,nationalpost,The teen in the MAGA hat and the elderly Native American: Duelling accounts at DC protest,[]
170,2019-01-21T13:58:14.000Z,1087348649842130944,14216661,The teen in the MAGA hat and the elderly Native American: Duelling accounts at DC protest https://t.co/uNjXo5KlMR https://t.co/3qEhjKqsSb,nationalpost,The teen in the MAGA hat and the elderly Native American: Duelling accounts at DC protest,[]
171,2019-01-04T16:10:20.000Z,1081221301195427842,14216661,"Tax tips to kickstart 2019 for every age group, from teens to seniors https://t.co/2C90jxk2k0 https://t.co/fELyV8CWWL",nationalpost,"Tax tips to kickstart 2019 for every age group, from teens to seniors",[]
172,2018-12-27T15:13:10.000Z,1078307811690536960,14216661,Two seniors drown when their golf cart is rammed and they’re thrown into river on Thai course https://t.co/C4wGglN8BP https://t.co/re02IoovtT,nationalpost,Two seniors drown when their golf cart is rammed and theyre thrown into river on Thai course,[]
173,2018-12-20T12:03:05.000Z,1075723258530545667,14216661,What retirees need to know if they plan to defer Old Age Security benefits until 70 https://t.co/6TOpIO2t0l #CanadaPensionPlan #OldAgeSecurity https://t.co/7msS6pxOTi,nationalpost,What retirees need to know if they plan to defer Old Age Security benefits until 70 CanadaPensionPlan OldAgeSecurity,"['CanadaPensionPlan', 'OldAgeSecurity']"
174,2018-12-19T14:59:27.000Z,1075405254160777218,14216661,Elderly man died in October — but bought 14 years of Christmas presents for his neighbours' daughter https://t.co/alEiWC6QAs https://t.co/bjE2ROtA3h,nationalpost,Elderly man died in October but bought 14 years of Christmas presents for his neighbours' daughter,[]
175,2018-11-27T22:47:32.000Z,1067550519806361602,14216661,Christie Blatchford: B.C. lawyer wins fight to have Indigenous elder on panel hearing complaint against him https://t.co/90ttp5BmQO https://t.co/y11w8hIKfz,nationalpost,Christie Blatchford: B.C. lawyer wins fight to have Indigenous elder on panel hearing complaint against him,[]
176,2018-11-05T18:33:32.000Z,1059514066639687680,14216661,"Amid labour crunch, fast food restaurants recruit senior citizens to replace teenage workers https://t.co/DoGQszPomc https://t.co/YNtNN9Rrnz",nationalpost,"Amid labour crunch, fast food restaurants recruit senior citizens to replace teenage workers",[]
177,2018-10-12T01:22:27.000Z,1050557276715720705,14216661,A neurological researcher stole $87K from universities. His punishment is to play piano for elderly people https://t.co/pnD1QoWMN8 https://t.co/sNoUFBEbkN,nationalpost,A neurological researcher stole $87K from universities. His punishment is to play piano for elderly people,[]
178,2018-10-01T21:43:58.000Z,1046878415037575169,14216661,From @TheGrowthOp: Will legal weed lure straight-laced seniors?  https://t.co/iM5VRxMpES https://t.co/l4rgKlEkxa,nationalpost,From : Will legal weed lure straight-laced seniors?,[]
